{
  "$schema": "./story-aeneid-delivery.schema.json",
  "network": {
    "name": "story-aeneid",
    "chainId": 1315,
    "deployRpcUrl": "https://aeneid.storyrpc.io"
  },
  "deployment": {
    "tag": "submission-speed-staging-20260608",
    "deployerAddress": "0xD713708b8460aB234BBb578C87Ca3EFf6aFcE3D4",
    "ownerAddress": "0xD713708b8460aB234BBb578C87Ca3EFf6aFcE3D4",
    "completedAt": "2026-06-08"
  },
  "contracts": {
    "purchaseEntitlementToken": "0x0814e763acB216E4DC1De527A1f7F64E95E89479",
    "pirateSignerRegistry": "0x79fCBB247d31B76A7B370A7f3Bb5F8F278598E74",
    "tokenGateCondition": "0xE80Efee2e820948926d62A489149f587cF797766",
    "signedAccessConditionV1": "0xf52505d911259840B0E58f2Bd0DF0A277Dbcfd3D",
    "assetPublishCoordinatorV1": "0x92a374FC27e40e0e76D5dF2855BD97fE7f39572A",
    "marketplaceSettlementV1": "0x1be1923195Be0f8a00dcBbA6aD4358009786Ec81",
    "purchaseEntitlementClassConfigurer": "0x326ebDA1320B2e61Ee09e3a3181f6925042F5Dc8"
  },
  "grants": {
    "publishOperator": "0xc77Ad4de7d179FFFBa417cA24c055d86Af69F4BB",
    "settlementOperator": "0x526331ddA08972173C485b874956818E8a0b7D2F",
    "accessProofSigner": "0xc77Ad4de7d179FFFBa417cA24c055d86Af69F4BB",
    "entitlementClassConfigurer": "0xbE03F72356A82F830811c1f487Bc18400CB85734"
  }
}
